{
  "$schema": "https://json-schema.org/draft/2020-12/schema",
  "type": "object",
  "required": [
    "items",
    "total",
    "page",
    "pageSize",
    "totalPages"
  ],
  "properties": {
    "items": {
      "type": "array",
      "items": {
        "type": "object",
        "required": [
          "id",
          "materialId",
          "materialName",
          "thickness",
          "width",
          "height",
          "quantity",
          "source",
          "status",
          "location",
          "createdAt",
          "updatedAt"
        ],
        "properties": {
          "id": {
            "type": "string"
          },
          "materialId": {
            "type": "string"
          },
          "materialName": {
            "type": "string"
          },
          "thickness": {
            "type": "integer"
          },
          "width": {
            "type": "integer"
          },
          "height": {
            "type": "integer"
          },
          "quantity": {
            "type": "integer"
          },
          "source": {
            "type": "string"
          },
          "status": {
            "type": "string"
          },
          "location": {
            "type": "string"
          },
          "createdAt": {
            "type": "string"
          },
          "updatedAt": {
            "type": "string"
          }
        },
        "additionalProperties": true
      }
    },
    "total": {
      "type": "integer"
    },
    "page": {
      "type": "integer"
    },
    "pageSize": {
      "type": "integer"
    },
    "totalPages": {
      "type": "integer"
    }
  },
  "additionalProperties": true
}
