{
  "items": [
    {
      "id": "sheet-1",
      "materialId": "mat-1",
      "materialName": "Q235",
      "thickness": 3,
      "width": 3000,
      "height": 1500,
      "quantity": 6,
      "source": "plate",
      "status": "in_stock",
      "location": "A-01",
      "createdAt": "2026-02-13T02:00:00.000Z",
      "updatedAt": "2026-02-13T02:00:00.000Z"
    }
  ],
  "total": 1,
  "page": 1,
  "pageSize": 20,
  "totalPages": 1
}
